153,comm,comm/PLoS_One/PMC8099097.nxml,8099097,33951045.0,10.1371/journal.pone.0247147,,2021,fig_caption,2,The image is generated by Rasmol [41].,Results: Software used,used,Rasmol,,SM1356,software,,1
154,comm,comm/Sensors_(Basel)/PMC8398156.nxml,8398156,34450905.0,10.3390/s21165463,,2021,2.3. Positioning Stage,24,"The LabVIEW-based software was used to define the scanning parameters (area to scan, frequency sweep configuration…) and load them into the Arduino board",Results: Software used,used,LabVIEW,,SM2512,software,,1
155,comm,comm/PeerJ/PMC7278891.nxml,7278891,32547856.0,10.7717/peerj.9114,,2020,Gene family analysis,10,"The species tree was generated using STRIDE (Emms & Kelly, 2017), as part of OrthoFinder and used as the input phylogenetic tree for CAFÉ.",Results: Software used,used,CAFÉ,,SM32450,software,,1
156,comm,comm/Oncotarget/PMC5363636.nxml,5363636,27792999.0,10.18632/oncotarget.12864,,2016,Statistical analysis,29,Linkage disequilibrium (LD) analysis and haplotype analysis were performed using SHEsis software (http://analysis.bio-x.cn) [37],Results: Software used,used,SHEsis,,SM28434,software,,1
157,comm,comm/J_Cancer/PMC8408118.nxml,8408118,34475991.0,10.7150/jca.58524,,2021,UALCAN analysis,3,"UALCAN (http://ualcan.path.uab.edu) 12 is an effective online analysis tool and cancer database that enables the user to analyze data according to cancer stage, tumor grade, and patient race and weight, as well as the relative expression of genes of interest and clinicopathological characteristics in tumor and normal samples",Background: About software,mention,UALCAN,,SM27365,software,,2
158,comm,comm/Acta_Crystallogr_Sect_E_Struct_Rep_Online/PMC3247453.nxml,3247453,22220071.0,10.1107/S1600536811042401,,2011,,31,"Data collection: PROCESS-AUTO (Rigaku, 1998 ▶); cell refinement: PROCESS-AUTO; data reduction: CrystalStructure (Rigaku/MSC, 2004 ▶); program(s) used to solve structure: SIR2004 (Burla et al., 2005 ▶); program(s) used to refine structure: SHELXL97 (Sheldrick, 2008 ▶); molecular graphics: ORTEPIII (Burnett & Johnson, 1996 ▶); software used to prepare material for publication: SHELXL97.",Results: Software used,used,SIR2004,,SM12631,software,,1
159,comm,comm/Biotechnol_Biofuels/PMC4422585.nxml,4422585,25949521.0,10.1186/s13068-015-0253-8,,2015,Zymography analysis,47,"And the software Image J (BioRad, USA) was used to obtain the pictures.",Results: Software used,used,Image J,,SM434,software,,1
160,comm,comm/Mol_Genet_Genomic_Med/PMC7963429.nxml,7963429,33225636.0,10.1002/mgg3.1558,,2020,Detection of genetic mutation,11,"Because in silico prediction tools may give different result, a good rule is to consider a prediction only when Polyphen2 (http//genetics.bwh.harvard.edu/pph2/) SIFT (http//sift.jcvi.org/), and the CONsensus DELeteriousness score of missense mutations (Condel) disease prediction tools give the same result",Background: About software,mention,Polyphen2,,SM1393,software,,2
161,comm,comm/Int_J_Mol_Sci/PMC7037001.nxml,7037001,32013053.0,10.3390/ijms21030856,,2020,4.8. Statistics,45,"For the statistical analysis, the program IBM SPSS Statistic was used",Results: Software used,used,SPSS Statistic,,SM6606,software,,1
162,comm,comm/Sci_Rep/PMC5349567.nxml,5349567,28290543.0,10.1038/srep44350,,2017,Microbial composition and community structure analysis,11,"Based on the alignment of OTU representative sequences, a phylogenetic tree was then built using RAxML version 7.4.223 with the GTRGAMMA model, bootstrapping (1,000 replicates), best maximum likelihood tree inference, and displayed with iTol24 (http://itol.embl.de/) representing the output of PhyloH analysis with the ultra-small bacteria OTUs count as multibarplots",Results: Software used,used,RAxML,,SM1408,software,,1
163,comm,comm/J_Clin_Lab_Anal/PMC6528587.nxml,6528587,30737844.0,10.1002/jcla.22837,,2019,Statistical analysis,23,"SPSS 20.0 (SPSS Inc., Chicago, IL, USA) and Excel 2016 statistical software (Microsoft Corporation, Redmond, WA, USA) were used for data analysis",Results: Software used,used,Excel,2016,SM201,software,,1
164,comm,comm/Front_Pharmacol/PMC6002508.nxml,6002508,29937730.0,10.3389/fphar.2018.00588,,2018,Conclusion: an updated GSA-based workflow for PBPK modeling,49,"We found that applying the eFAST approach for a complex multi-compartment, multi-dataset, multi-metabolite PBPK model required less than 10 min of computational time on current hardware",Results: Software used,used,eFAST,,SM1879,software,,1
165,comm,comm/Rev_Soc_Bras_Med_Trop/PMC7094037.nxml,7094037,32130325.0,10.1590/0037-8682-0457-2019,,2020,Statistical analysis,23,Statistix 7.0 and Epi-Info 2008 version 3.5.1 were used to perform the analyses,Results: Software used,used,Epi-Info,2008,SM4096,software,,1
166,comm,comm/Eur_J_Nutr/PMC7987629.nxml,7987629,32789769.0,10.1007/s00394-020-02357-3,,2020,Arterial stiffness,19,"Arterial stiffness was measured using central (carotid– femoral) pulse wave velocity (aPWV) using a semi-automated device and software (SphygmoCor, AtCor Medical, Sydney, Australia) as previously described [39]",Results: Software used,used,SphygmoCor,,SM14997,software,,1
167,comm,comm/EBioMedicine/PMC4471147.nxml,4471147,26097890.0,10.1016/j.ebiom.2015.02.009,,2015,fig_caption,0,Parameters were generated through Michaelis–Menten kinetic experiments and analysed using Graphpad Prism software,Results: Software used,used,Graphpad Prism,,SM825,software,,1
168,comm,comm/Virol_J/PMC3651342.nxml,3651342,23602143.0,10.1186/1743-422X-10-124,,2013,Secondary structure analysis,15,"The secondary structure, as shown in Figure 6, was predicted using MFOLD software",Results: Software used,used,MFOLD,,SM572,software,,1
169,comm,comm/JMIR_Res_Protoc/PMC8196357.nxml,8196357,34047712.0,10.2196/29427,,2021,Strategies for Trustworthiness,33,Interviews will be transcribed and analyzed using NVivo 12 (QSR International) software [71],Results: Software used,used,NVivo,12,SM2203,software,,1
170,comm,comm/Front_Plant_Sci/PMC5443154.nxml,5443154,28596783.0,10.3389/fpls.2017.00877,,2017,fig_caption,4,Unrooted phylogenetic tree of the CaM and CML proteins from soybean ( The alignment for the phylogenetic tree was performed with ClustalW using full-length amino acid sequences,Results: Software used,used,ClustalW,,SM536,software,,1
171,comm,comm/BMC_Genomics/PMC4687377.nxml,4687377,26689712.0,10.1186/s12864-015-2318-2,,2015,"RNA isolation, library preparation and bioinformatic analysis",47,Mercator functional categories that are easily visualized as MapMan bins were annotated for all gene models,Results: Software used,used,MapMan,,SM1098,software,,1
172,comm,comm/BMC_Syst_Biol/PMC5405553.nxml,5405553,28446174.0,10.1186/s12918-017-0427-z,,2017,Flux Variability Analysis (FVA),32,FVA can be set up in COBRA toolbox using the function fluxVariability(),Results: Software used,used,COBRA,,SM27809,software,,1
173,comm,comm/Parkinsons_Dis/PMC4291192.nxml,4291192,25610706.0,10.1155/2014/852965,,2014,2.4. EEG/EMG/Video Analysis,7,EMG signals were analyzed directly using Spike2 (Figure 2),Results: Software used,used,Spike2,,SM7988,software,,1
174,comm,comm/BMC_Biol/PMC7304191.nxml,7304191,32560683.0,10.1186/s12915-020-00804-5,,2020,Gene trees for glycolytic enzymes reflect different patterns of gene loss and transfer,15,"These results were replicated across multiple genomes, and the phylogenetic associations of surrounding ORFs on the same scaffold were verified by BLAST to ensure that the scaffold originated from a CPR organism",Results: Software used,used,BLAST,,SM501,software,,1
175,comm,comm/Parasit_Vectors/PMC4316759.nxml,4316759,25623386.0,10.1186/s13071-015-0660-5,,2015,Results,9,When the 18 s RNA gene fragments from 30 positive foxes from 17 counties were sequenced and compared by BLAST with 18S rRNA sequences of Babesia and Theileria spp,Results: Software used,used,BLAST,,SM501,software,,1
176,comm,comm/Genome_Biol_Evol/PMC6414313.nxml,6414313,30668670.0,10.1093/gbe/evz009,,2019,TMRCA Analysis,26,PHYLIP v3.69 (Felsenstein 1989) was used to generate neighbor-joining phylograms for nucleotide positions of common 4D sites in E,Results: Software used,used,PHYLIP,,SM751,software,,1
177,comm,comm/Oncotarget/PMC5094990.nxml,5094990,27166252.0,10.18632/oncotarget.8959,,2016,Statistical analysis,40,"The SPSS 17.0 software package (SPSS Inc., Chicago, IL) was used",Results: Software used,used,SPSS,17,SM165,software,,1
178,comm,comm/Front_Immunol/PMC5600903.nxml,5600903,28955327.0,10.3389/fimmu.2017.01071,,2017,Caveats and Limitations,44,"Our linear modeling with DESeq2 employs appropriate FDR correction, but we choose to accept higher than “standard” p-values associated with LFC because of the direct connection between candidate genes and independently observed immune phenotypes",Results: Software used,used,DESeq2,,SM5912,software,,1
179,comm,comm/PLoS_One/PMC7182254.nxml,7182254,32330173.0,10.1371/journal.pone.0231778,,2020,2.4. Statistics,23,"Statistical analyses and plots were produced in the R environment [33], with the packages “OpenAir” [34] and “ggplot2” [35].",Results: Software used,used,R,,SM3,software,,1
180,comm,comm/Biotechnol_Biofuels/PMC8056674.nxml,8056674,33874976.0,10.1186/s13068-021-01948-4,,2021,Differential expression and enrichment analysis,96,"Using the lists of DE genes and functional annotation as inputs, topGO compared the number of DEGs in each category with the expected number of genes for the whole transcriptome",Results: Software used,used,topGO,,SM6649,software,,1
181,comm,comm/Autom_Exp/PMC2813846.nxml,2813846,20119518.0,10.1186/1759-4499-2-1,,2010,Towards the full automation of scientific discovery,3,"AM was an Automated Mathematician, a heuristic artificial intelligence program that modelled mathematical discovery in the mid 1970s [5]",Background: About software,mention,AM,,SM23595,software,,2
182,comm,comm/BMC_Public_Health/PMC3231906.nxml,3231906,21501451.0,10.1186/1471-2458-11-S3-S32,,2011,Calculating the effects of intermediate health outcomes on mortality,71,Within LiST however the risks for mortality vis-à-vis stunting are defined in terms of the following four bands on the international normal distribution for height for age:,Background: About software,mention,LiST,,SM22304,software,,2
184,comm,comm/Bull_World_Health_Organ/PMC7856354.nxml,7856354,33551507.0,10.2471/BLT.19.243907,,2021,Methods,11,"The analysis was conducted using LimeSurvey’s built-in statistical functions and Microsoft Excel 2010 with the Analysis ToolPak (Microsoft Corporation, Redmond, USA)",Results: Software used,used,Excel,2010,SM201,software,,1
185,comm,comm/Oncotarget/PMC8169072.nxml,8169072,34084282.0,10.18632/oncotarget.27963,,2021,Co-localization analysis,31,The obtained values were plotted in Sigma Plot 10.2 and statistical analyses were carried out.,Results: Software used,used,Sigma Plot,10.2,SM500,software,,1
186,comm,comm/Acta_Crystallogr_D_Biol_Crystallogr/PMC3322598.nxml,3322598,22505259.0,10.1107/S090744491104978X,,2012,fig_caption,1,"Of the three interfaces, interface 1 involves the most extensive interactions, with a buried suface area of 1569 Å2 (compared with 541 Å2 for interface 2 and 276 Å2 for interface 3; the buried surface areas were computed with the PDBePISA server)",Results: Software used,used,PDBePISA,,SM9743,software,,1
187,comm,comm/Brain_Behav/PMC5036437.nxml,5036437,27688944.0,10.1002/brb3.518,,2016,Longitudinal consistency,42,"On a longitudinal data set of patients with MS (data set 3), the correlation between whole‐brain atrophy measurements obtained with MSmetrix‐long and SIENA is relatively high, with a Pearson correlation coefficient equal to 0.91 and an intraclass correlation coefficient of 0.90",Results: Software used,used,SIENA,,SM30679,software,,1
188,comm,comm/J_Biol_Chem/PMC7974028.nxml,7974028,33600795.0,10.1016/j.jbc.2021.100419,,2021,BMDC penetration assay,44,The data were acquired on LSR Fortessa (BD Biosciences) flow cytometer running Diva 8 software and analyzed with FlowJo 10.6.2 (BD Biosciences).,Results: Software used,used,Diva,8,SM4499,software,,1
189,comm,comm/PLoS_Comput_Biol/PMC1885275.nxml,1885275,17542641.0,10.1371/journal.pcbi.0030100,,2007,Dynamic causal modelling.,37,"DCM, therefore, can also be regarded as more general, with the general linear model analysis being a specific situation in which the interaction parameters (first and second sets) are assumed to be zero.",Background: About software,mention,DCM,,SM5175,software,,2
190,comm,comm/Sci_Rep/PMC5638828.nxml,5638828,29026137.0,10.1038/s41598-017-12066-3,,2017,Data analysis,13,"Statistical analyses were performed with SPSS16.0 (SPSS Inc., Chicago, Illinois, USA), and graphs were created using GraphPad Prism, version 5.0 (GraphPad Software Inc., San Diego, California, USA).",Results: Software used,used,GraphPad,,SM46,software,,1
191,comm,comm/BMC_Proc/PMC2795907.nxml,2795907,20018000.0,,,2009,,14,"Again, we note a striking lack of agreement between calls resulting from CNAM and GADA.",Results: Software usage in comparison,used,GADA,,SM71297,software,,1
192,comm,comm/Cureus/PMC7430542.nxml,7430542,32821576.0,10.7759/cureus.9227,,2020,paper_abstract,0,"The statistical analysis of data was performed with the Statistical Package for the Social Sciences (SPSS) for Windows, Version 13.0 (SPSS Inc, Chicago, IL)",Results: Software used,used,Statistical Package for the Social Sciences (SPSS),,SM4219,software,,1
193,comm,comm/FEBS_Open_Bio/PMC7396444.nxml,7396444,32569434.0,10.1002/2211-5463.12913,,2020,Statistical analysis,36,"All statistical analyses were performed using the graphpad prism 8.0 (GraphPad Software Inc., San Diego, CA, USA) and spss 19.0 software (SPSS, Chicago, IL, USA).",Results: Software used,used,GraphPad,,SM46,software,,1
195,comm,comm/PLoS_One/PMC4972368.nxml,4972368,27487029.0,10.1371/journal.pone.0160520,,2016,Discussion,41,"We found inflammatory processes and TNF signaling were significantly associated with sALS group-specific gene expression changes (IPA) using independent exploratory DEG tests (Cuffdiff2, DESeq2, and EdgeR) and an unsupervised gene network analysis (WGCNA)",Results: Software used,used,Cuffdiff2,,SM24440,software,,1
196,comm,comm/Microorganisms/PMC7285296.nxml,7285296,32429503.0,10.3390/microorganisms8050751,,2020,2.4. Statistical Analysis,6,"The vegan package in R (http://vegan.r-forge.r-project.org/) was used to rarefy the 28 bacterial microbiomes and to quantify alpha (Shannon diversity, Simpson index, and Observed number of genera) and beta diversity indices",Results: Software used,used,vegan,,SM745,software,,1
197,comm,comm/Clin_Exp_Dent_Res/PMC6305924.nxml,6305924,30603107.0,10.1002/cre2.139,,2018,Processing of bacterial 16S rRNA gene sequence data,10,"Using USEARCH (version 9.2), sequences were merged and filtered to remove poor‐quality sequences, singletons, and sequences <350 base pairs (bp)",Results: Software used,used,USEARCH,,SM5133,software,,1
198,comm,comm/Commun_Biol/PMC7018711.nxml,7018711,32054967.0,10.1038/s42003-020-0779-6,,2020,Skull size data and evolutionary rates,31,"To generate this consensus the branch lengths for all trees were substituted with the mean rate scalars, then the mean branch lengths from all 100 trees are calculated, ignoring edges that were not present in all trees (using R packages phytools and ggtree)",Results: Software used,used,ggtree,,SM3639,software,,1
199,comm,comm/Sci_Rep/PMC6934623.nxml,6934623,31882797.0,10.1038/s41598-019-56544-2,,2019,fig_caption,3,SimPlot was constructed using a Simplot software version 3.5 with a slide window width of 200 bp and a step size of 20 bp,Results: Software used,used,Simplot,,SM4020,software,,1
0,non_comm,non_comm/Curr_Protoc_Mol_Biol/PMC7781197.nxml,7781197,33351266.0,10.1002/cpmb.131,,2020,CASE STUDIES,38,"A comparison of UltraScan results with SEDFIT results is provided in the “Basics of SV‐AUC Data Analysis in UltraScan and SEDFIT.” All other modeled values presented were extracted using iterative 2DSA (2DSA‐IT) in UltraScan III, with Monte Carlo or genetic algorithm optimization where indicated",,used,SEDFIT,,SM1991,software,Results: Software usage in comparison,1
1,non_comm,non_comm/Biol_Proced_Online/PMC516205.nxml,516205,15361931.0,10.1251/bpo88,,2004,Estimating model parameters,11,"These analyses can also be done using PAML (23), and PAML is necessary for analyzing non-reversible models, but the “unrestricted” model in PAML has many more free parameters than the GTR model, and perhaps because of this over-parameterization it gave ambiguous results",,mention,PAML,,SM4922,software,Background: About software,2
2,non_comm,non_comm/Cell_Rep/PMC7090384.nxml,7090384,32187536.0,10.1016/j.celrep.2020.02.083,,2020,Electrophysiology,101,"One or two CA3 pyramidal cells were then whole-cell voltage clamped using a glass pipette (2.5-3.0 MΩ) filled with internal solution (100 mM KCl, 50 mM K-gluconate, 10 mM HEPES, 4 mM ATP-Mg, 0.3 mM GTP-Na, 0.1 mM EGTA, and 0.4% biocytin, pH 7.4, 300 mOsm) and the holding potential was set at −70 mV using an EPC-10 amplifier [Patchmaster 2 software (HEKA/Harvard Bioscience)]",,used,Patchmaster,2,SM14617,software,Results: Software used,1
3,non_comm,non_comm/Oncol_Lett/PMC8045162.nxml,8045162,33868488.0,10.3892/ol.2021.12711,,2021,Statistical analysis,10,Statistical analyses were performed using SPSS 19.0 (IBM Corp.),,used,SPSS,19,SM165,software,Results: Software used,1
5,non_comm,non_comm/Cell_Rep/PMC7357864.nxml,7357864,31995752.0,10.1016/j.celrep.2019.12.086,,2020,dpErk quantification,44,"ImageJ software was used to draw a 25×25pi circle inside cells in the CySC position (i.e., in very close proximity to the hub) and the mean of fluorescence of the dpErk signal was obtained, followed by a second measure of same area of the most nearby hub cell",,used,ImageJ,,SM25,software,Results: Software used,1
6,non_comm,non_comm/J_Vet_Intern_Med/PMC6766539.nxml,6766539,31397009.0,10.1111/jvim.15577,,2019,Statistical and data analysis,19,"Commercial statistical software packages (MedCalc 15.8 MedCalc Software, Ostend, Belgium; SAS 9.4 release TS1M5, SAS Institute Inc, Cary, North Carolina) were used for all analyses",,used,MedCalc,15.8,SM5482,software,Results: Software used,1
7,non_comm,non_comm/Nucleic_Acids_Res/PMC5716205.nxml,5716205,29036314.0,10.1093/nar/gkx836,,2017,CONCLUSION,49,"Additionally, our approach exceeds miRDeep2’s performance when genome information is available and does so at a significantly lower computational cost",,used,miRDeep2,,SM1666,software,Results: Software usage in comparison,1
8,non_comm,non_comm/Biochemistry/PMC4159212.nxml,4159212,25137435.0,10.1021/bi500693a,,2015,Multiangle Light Scattering,26,The data were analyzed using ASTRA software (Wyatt Technology).,,used,ASTRA,,SM3517,software,Results: Software used,1
9,non_comm,non_comm/Int_J_Biol_Sci/PMC3164151.nxml,3164151,21912509.0,,,2011,Identification of novel cattle miRNAs,18,"We investigated the chromosome locations (BTAU4.0) for the known miRNAs in the MiRBase, searching for the known and novel pre-miRNAs via BLAST analysis",,used,BLAST,,SM501,software,Results: Software used,1
10,non_comm,non_comm/China_CDC_Wkly/PMC8422210.nxml,8422210,34594692.0,10.46234/ccdcw2020.140,,2020,,3,"Annual percent change (APC) and average annual percent change (AAPC) with 95% CIs were calculated by Joinpoint Regression models with Joinpoint software (Depuy Orthopaedics Inc, IN, USA) among total elderly with disabilities and sub-population by age, sex, and residence",,used,Joinpoint,,SM28355,software,Results: Software used,1
12,non_comm,non_comm/Int_J_Nanomedicine/PMC5901201.nxml,5901201,29692610.0,10.2147/IJN.S158585,,2018,In vivo pharmacokinetic studies,14,"The pharmacokinetic parameters, such as the area under the plasma concentration–time curve (AUC), elimination half-life and mean residence time were determined by DAS 3.0 software (Mathematical Pharmacology Professional Committee of China).",,used,DAS,3,SM22828,software,Results: Software used,1
13,non_comm,non_comm/Cell_Rep/PMC6342559.nxml,6342559,30540944.0,10.1016/j.celrep.2018.11.058,,2019,DATA AND SOFTWARE AVAILABILITY,42,"Phylogenetic associations were made using MEGA (Tamura et al., 2013) and PhyML (Guindon et al., 2010)",,used,MEGA,,SM509,software,Results: Software used,1
14,non_comm,non_comm/J_Midlife_Health/PMC6166421.nxml,6166421,30294181.0,10.4103/jmh.JMH_21_18,,2018,MATERIALS AND METHODS,1,"Statistical analysis was then performed with SPSS software version 22 (Armonk, NY: IBM Corp.).",,used,SPSS,,SM165,software,Results: Software used,1
15,non_comm,non_comm/Proc_Natl_Acad_Sci_U_S_A/PMC7959525.nxml,7959525,33067392.0,10.1073/pnas.2004563117,,2020,Preparation of a Dsc/Dsg Heterodimer.,37,"The EC1 domain of Dsc2 was aligned with the corresponding domain in one of the chains of the Dsg2 dimer using PyMOL (Version 2.0; Schrödinger, LLC)",,used,PyMOL,,SM707,software,Results: Software used,1
16,non_comm,non_comm/DNA_Res/PMC3925395.nxml,3925395,24104396.0,10.1093/dnares/dst042,,2014,,29,The genes were analysed using BiNGO and the biological process terms showing significant enrichment are shown,,used,BiNGO,,SM6650,software,Results: Software used,1
17,non_comm,non_comm/Sci_Adv/PMC7428336.nxml,7428336,32851152.0,10.1126/sciadv.aav8207,,2020,CW-EPR on NTS1,30,"Nelder-Mead optimization in R was subsequently used to fit sine functions to (ΔH0)−1 (average of the two biological repeats) plotted against residue number (374 to 393) for all possible residue stretches, discarding results for stretches shorter than four residues",,used,R,,SM3,software,Results: Software used,1
18,non_comm,non_comm/J_Insect_Sci/PMC5633980.nxml,5633980,25399433.0,10.1093/jisesa/ieu041,,2014,Amino Acid Sequences of PxPAP Proteins and Phylogenetic Analysis,23,NetNGlyc and NetOGlyc programs suggest that there are 2 potential N-linked glycosylation and 13 potential O-linked glycosylation sites present in the amino acid sequence of pxPAP3,,used,NetNGlyc,,SM1076,software,Results: Software used,1
19,non_comm,non_comm/J_Exp_Med/PMC7201929.nxml,7201929,32302378.0,10.1084/jem.20191388,,2020,ChIP-seq,33,"Peaks were filtered in R-studio (using GenomeInfoDb and ChIP blacklist GenomicRanges packages) to remove reads with alternative annotations, mitochondrial DNA, or blacklist sites (Carroll et al., 2014).",,used,R-studio,,SM2235,software,Results: Software used,1
20,non_comm,non_comm/Biomed_Opt_Express/PMC3130576.nxml,3130576,21750767.0,10.1364/BOE.2.001893,,2011,fig_caption,3,The Fortran code was run by imposing nmax = and mmax = 15,,used,Fortran,,SM7574,software,Results: Software used,1
21,non_comm,non_comm/J_Cell_Biol/PMC4674279.nxml,4674279,26620909.0,10.1083/jcb.201505091,,2015,Immunofluorescence staining,42,"Confocal images were acquired using a microscope (LSM710; Carl Zeiss) equipped with 100× 1.40 NA oil objectives, with Immersol 518F (Carl Zeiss) as imaging medium and a camera (AxioCam HRc; Carl Zeiss) under the control of Zen 2008 software (Carl Zeiss)",,used,Zen,2008,SM7673,software,Results: Software used,1
22,non_comm,non_comm/FEBS_Open_Bio/PMC4556729.nxml,4556729,26380811.0,10.1016/j.fob.2015.08.001,,2015,TUNEL analysis,11,The number of apoptotic cells were counted and divided by the total number of cells per field of view using ImageJ software (National Institutes of Health).,,used,ImageJ,,SM25,software,Results: Software used,1
23,non_comm,non_comm/Poult_Sci/PMC6698187.nxml,6698187,30895317.0,10.3382/ps/pez122,,2019,MATERIALS AND METHODS,17,The authors provide a Mathematica file as supporting material,,used,Mathematica,,SM1791,software,Results: Software used,1
24,non_comm,non_comm/Meta_Gene/PMC8106235.nxml,8106235,33996501.0,10.1016/j.mgene.2021.100910,,2021,fig_caption,0,The BLAST results for the lowest expected value (E-value) (highest chance of targeting) are shown,,used,BLAST,,SM501,software,Results: Software used,1
25,non_comm,non_comm/Ann_Rehabil_Med/PMC7655223.nxml,7655223,32986945.0,10.5535/arm.19198,,2020,Statistical analysis,6,"All statistical analyses were estimated using SPSS version 25.0 (IBM SPSS, Armonk, NY, USA).",,used,SPSS,,SM165,software,Results: Software used,1
26,non_comm,non_comm/Nat_Genet/PMC4138798.nxml,4138798,25038751.0,10.1038/ng.3042,,2014,Gene Feature Annotation,34,"Genewise and Exonerate produced coding sequence models using marmoset and human UniProt, SwissProt/TrEMBL (see URLs) and RefSeq proteins mapped to the genome (Pmatch, Durbin, unpublished) (Supplementary Figures 6b, 6c)",,used,Genewise,,SM82578,software,Results: Software used,1
27,non_comm,non_comm/Nucleic_Acids_Res/PMC3367202.nxml,3367202,22362730.0,10.1093/nar/gks169,,2012,Replicated sequences in autosomes and sex chromosomes explain the effect of sex on autosomal SNPs,15,We used BLAST to search the entire genome for sequences exhibiting homology within the larger region corresponding to the restriction fragment containing the SNP,,used,BLAST,,SM501,software,Results: Software used,1
29,non_comm,non_comm/Medicine_(Baltimore)/PMC8257836.nxml,8257836,34190151.0,10.1097/MD.0000000000026336,,2021,Statistical analysis,16,"All analyses were performed by SPSS 25.0 (IBM Corp., Armonk, NY, USA) software",,used,SPSS,25,SM165,software,Results: Software used,1
30,non_comm,non_comm/Clin_Ophthalmol/PMC8435478.nxml,8435478,34526763.0,10.2147/OPTH.S324386,,2021,Introduction,4,"The purpose of this study is to assess the safety, aberrometric and keratometric changes, and stability of trans-epithelial topography-guided phototherapeutic keratectomy (TE-TG-PTK) using the ALLEGRO Topolyzer platform for the treatment of irregular astigmatism.",,used,ALLEGRO,,SM16067,software,Results: Software used,1
