109,non_comm,non_comm/Heliyon/PMC7848562.nxml,7848562,33553784.0,10.1016/j.heliyon.2021.e06167,,2021,Analysis of protein dynamicity,8,"For this analysis, the crystal structure of N protein was first uploaded on DynaMut webserver",,used,DynaMut,,SM47218,software,Results: Software used,1
112,non_comm,non_comm/Nucleic_Acids_Res/PMC5314794.nxml,5314794,27672034.0,10.1093/nar/gkw855,,2017,,29,"DHT, TNFα and D+T-induced changes in gene transcription were measured using GRO-seq and enrichment of differentially transcribed genes to biological processes was analyzed by Ingenuity Pathway Analysis",,used,Ingenuity Pathway,,SM16802,software,Results: Software used,1
113,non_comm,non_comm/Bioinform_Biol_Insights/PMC4415676.nxml,4415676,25983554.0,10.4137/BBI.S12467,,2015,,41,The gene expression raw data were normalized using BRB Array Tools using the LOWESS smother,,used,BRB Array Tools,,SM39888,software,Results: Software used,1
114,non_comm,non_comm/Alzheimers_Dement_(Amst)/PMC8087978.nxml,8087978,33969172.0,10.1002/dad2.12179,,2021,Data processing and statistical analysis,30,Data processing was performed in Skyline 20.1 (MacCoss Lab Software),,used,Skyline,20.1,SM1833,software,Results: Software used,1
115,non_comm,non_comm/ACS_Omega/PMC6648847.nxml,6648847,31460026.0,10.1021/acsomega.9b00535,,2019,General Experimental Procedures,21,"All the raw data were processed using TopSpin 3.1 software (Bruker) and further analyzed by using MestReNova 8.0 software (Mestrelab Research S.L., Spain).",,used,MestReNova,8,SM2243,software,Results: Software used,1
116,non_comm,non_comm/Oncol_Lett/PMC6865087.nxml,6865087,31788059.0,10.3892/ol.2019.10933,,2019,Hub gene selection and analysis,7,The biological process of hub genes was then analyzed and visualized by the Biological Networks Gene Oncology tool (BiNGO; http://apps.cytoscape.org/apps/bingo) plugin (22),,used,BiNGO,,SM6650,software,Results: Software used,1
117,non_comm,non_comm/Neuropsychiatr_Dis_Treat/PMC5008640.nxml,5008640,27616888.0,10.2147/NDT.S109094,,2016,Materials and methods,5,"Diffusion data were processed offline in FSL v5 (FMRIB Software Library, Oxford, UK)28 and subjected to eddy current and motion correction, followed by brain extraction.29 Dtifit was then used to generate fractional anisotropy (FA), mean diffusivity (MD), RD, and AD maps (Table 2)",,used,FMRIB,,SM14732,software,Results: Software used,1
118,non_comm,non_comm/J_Med_Phys/PMC6299753.nxml,6299753,30636847.0,10.4103/jmp.JMP_33_18,,2018,CONCLUSIONS,33,Small aperture proton beams are problematic for the Eclipse pencil-beam calculation algorithm,,mention,Eclipse,,SM356,software,Background: About software,2
119,non_comm,non_comm/BMJ_Paediatr_Open/PMC5862217.nxml,5862217,29637126.0,10.1136/bmjpo-2017-000091,,2017,Statistical analysis,18,Data were entered into a neonatal database using Research Electronic Data Capture (REDCap) software.18 Data were exported into IBM SPSS V.23 for statistical analysis,,used,Research Electronic Data Capture (REDCap),,SM20006,software,Results: Software used,1
120,non_comm,non_comm/Bioinformatics/PMC2894505.nxml,2894505,20505005.0,10.1093/bioinformatics/btq250,,2010,,7,Integrating the Annotator with UIMA requires a type system specification that defines the Java classes used to store annotations,,mention,UIMA,,SM90722,software,Background: About software,2
121,non_comm,non_comm/Oncogene/PMC5945577.nxml,5945577,29467494.0,10.1038/s41388-018-0129-z,,2018,tab_caption,1,"Genes with statistically significant splicing identified by all three bioinformatics methods (FIRMA, MIDAS, ANOSVA) with five and more consecutive exon spliced",,used,MIDAS,,SM10905,software,Results: Software used,1
122,non_comm,non_comm/Database_(Oxford)/PMC3500519.nxml,3500519,23160413.0,10.1093/database/bas040,,2012,Further improvements to the Textpresso for cellular component curation pipeline,62,Such a display would more closely mimic the actual environment in which curators make annotations and eliminate the need for curators to open up a separate Web page to cross-check Textpresso sentences with the full text of the paper,,used,Textpresso,,SM78875,software,Results: Software used,1
123,non_comm,non_comm/Cancer_Manag_Res/PMC5731441.nxml,5731441,29276405.0,10.2147/CMAR.S147033,,2017,Statistical analysis,5,"The extracted HRs/RRs were summarized as pooled HR and 95% CI values, using Stata, version 12.0",,used,Stata,,SM2198,software,Results: Software used,1
124,non_comm,non_comm/Brain/PMC5972584.nxml,5972584,29668857.0,10.1093/brain/awy092,,2018,Structural modelling,13,We calculated the free energy change upon the Asp85Tyr mutation with the FoldX software (foldxsuite.crg.eu) using the crystal structure of the V1 domain from Enterococcus hirae v-ATPase in a nucleotide-bound state (PDB code 3VR6),,used,FoldX,,SM1483,software,Results: Software used,1
125,non_comm,non_comm/J_Adv_Model_Earth_Syst/PMC7757180.nxml,7757180,33381276.0,10.1029/2020MS002121,,2020,Introduction,2,"However, as the sediment budget module was not embedded into the terrestrial C cycle model (in this case, the ORCHIDEE LSM), this approach cannot account for the feedbacks of soil erosion on the ecosystem C cycle",,used,ORCHIDEE,,SM314767,software,Results: Software used,1
126,non_comm,non_comm/Neurol_Med_Chir_(Tokyo)/PMC4831945.nxml,4831945,26794042.0,10.2176/nmc.tn.2015-0155,,2016,Materials and Methods,4,"MATLAB option, or the Image Processing Toolbox, was used for reading DICOM files, utilizing the graphical user interface for plotting and moving points on the pictorial images, and superposition of multiple images were recorded",,used,MATLAB,,SM30,software,Results: Software used,1
127,non_comm,non_comm/Nature/PMC3743022.nxml,3743022,23728301.0,10.1038/nature12243,,2013,Multiplexed RNA Sequencing and data analysis,12,"For the Plath and Polo dataset, data were RMA normalised using the ‘affy’ package in R and DEGs were identified using the ‘limma’ package in R with FC>=1.5 and FDR<=0.05 or FC>=1.5 where no replicates were available",,used,limma,,SM2939,software,Results: Software used,1
128,non_comm,non_comm/Acta_Neurochir_(Wien)/PMC2901492.nxml,2901492,20473532.0,10.1007/s00701-010-0678-6,,2010,Data processing,16,"In order to clean the data from noise, filtering was performed using in-house written routines in the Matlab environment (The Math Works, Inc., Natwick, MA, USA, Matlab 6.5)",,used,Matlab,,SM93,software,Results: Software used,1
129,non_comm,non_comm/Infect_Drug_Resist/PMC7399467.nxml,7399467,32801792.0,10.2147/IDR.S257667,,2020,Statistical Analysis,8,"After checking for the completeness and consistency, data were entered into the Epi-info 7.1 and then exported into SPSS version 20 for computing, recoding, and further analysis",,used,SPSS,,SM165,software,Results: Software used,1
130,non_comm,non_comm/Soft_comput/PMC7453871.nxml,7453871,32904395.0,10.1007/s00500-020-05275-y,,2020,paper_abstract,0,"In this study, convolution neural networks method is used for binary classification pneumonia-based conversion of VGG-19, Inception_V2 and decision tree model on X-ray and CT scan images dataset, which contains 360 images",,used,Inception,,SM5757,software,Results: Software used,1
131,non_comm,non_comm/Ann_Pediatr_Cardiol/PMC6343373.nxml,6343373,30745767.0,10.4103/apc.APC_49_18,,2019,Statistical analyses,8,"All tests were carried out using SPSS Version 23 software (IBM Corp., NY, USA)",,used,SPSS,,SM165,software,Results: Software used,1
132,non_comm,non_comm/Bioinformatics/PMC4553834.nxml,4553834,26072489.0,10.1093/bioinformatics/btv265,,2015,1 Introduction,1,"However, even the most popular tools such as DAVID and GSEA lack major functionality or comprehensive data content found in other tools, forcing users to try out several tools and combining findings manually.",,mention,DAVID,,SM637,software,Background: About software,2
133,non_comm,non_comm/Chin_Med_J_(Engl)/PMC4797545.nxml,4797545,26712435.0,10.4103/0366-6999.172589,,2016,Statistical analysis,11,"Analyses were performed using the SPSS statistics software (version 22.0, IBM Corp., Armonk, NY, USA).",,used,SPSS,,SM165,software,Results: Software used,1
134,non_comm,non_comm/J_Pathol_Clin_Res/PMC4858117.nxml,4858117,27499890.0,10.1002/cjp2.3,,2014,Discussion,46,"For ER, PR and HER2, they were lower than previously reported by our group using the Ariol system 14, or an automated scoring algorithm adapted from astronomy 15, possibly reflecting the greater variability in tissue preparation related to multiple specimen sources",,used,Ariol,,SM18057,software,Results: Software used,1
135,non_comm,non_comm/Genome_Biol/PMC3245610.nxml,3245610,21861851.0,10.1186/gb-2011-12-8-307,,2011,The data deluge: still keeping our heads above water,1,"The degree to which bioinformatics already embraces this philosophy was, fortunately, evident in ISMB's Technology Track, which highlighted popular open tools throughout the conference, particularly mainstays of sequence analysis including Ensembl, the University of California Santa Cruz's Genome Browser, and Galaxy.",,mention,Galaxy,,SM6355,software,Background: Simple mention,2
136,non_comm,non_comm/Stem_Cells/PMC6392140.nxml,6392140,30353617.0,10.1002/stem.2932,,2018,CAMSC Classifier Creation,12,"To statistically evaluate the degree of data variability, principal components analysis (PCA) was run on the top‐50 univariate p‐value genes using the “PCA” and “fviz_pca” functions in R, with an ellipse alpha = 0.95 for graphical visualization",,used,R,,SM3,software,Results: Software used,1
137,non_comm,non_comm/Theor_Appl_Genet/PMC3057001.nxml,3057001,21221527.0,10.1007/s00122-010-1519-y,,2011,fig_caption,0,"Log-likelihood of the STRUCTURE software outputs as a function of the number of degrees of freedom absorbed by the structure model (filled diamond), and the mean of the log-likelihood of 20 STRUCTURE independent runs as a function of the number of degrees of freedom absorbed by the structure model (solid line)",,used,STRUCTURE,,SM830,software,Results: Software used,1
138,non_comm,non_comm/J_Cell_Biol/PMC6279379.nxml,6279379,30297389.0,10.1083/jcb.201711178,,2018,Fluorescent microscopy,60,The images were processed for background subtraction and further analysis using ImageJ.,,used,ImageJ,,SM25,software,Results: Software used,1
139,non_comm,non_comm/Nucleic_Acids_Res/PMC5009739.nxml,5009739,27257077.0,10.1093/nar/gkw501,,2016,fig_caption,5,"Without the a priori knowledge of the missing transcripts, DEXSeq cannot reliably detect differential usage",,mention,DEXSeq,,SM29161,software,Background: About software,2
140,non_comm,non_comm/Endosc_Int_Open/PMC5063731.nxml,5063731,27747288.0,10.1055/s-0042-116146,,2016,Patients and methods,5,"To evaluate the therapeutic effect, a local control curve and an overall survival curve were constructed using the Kaplan–Meier method with EZR (Saitama Medical Center, Jichi Medical University, Saitama, Japan), which is a graphical user interface for R (The R Foundation for Statistical Computing, Vienna, Austria)",,used,R,,SM3,software,Results: Software used,1
141,non_comm,non_comm/J_Int_Med_Res/PMC6753526.nxml,6753526,31429352.0,10.1177/0300060519867806,,2019,Data extraction and outcome measures,6,"Following removal of duplicate publications identified using EndNote, two authors (JZ and XHW) independently assessed study eligibility by screening titles and abstracts",,used,EndNote,,SM1969,software,Results: Software used,1
142,non_comm,non_comm/Cell_Death_Dis/PMC3920943.nxml,3920943,24176859.0,10.1038/cddis.2013.433,,2013,Statistical analysis,39,"The mRNA expression data sets (http://www.cgga.org.cn) of SATB1, PKC and miR-155 obtained from the microarray analysis were used for cluster analysis (Cluster 2.20) and Pearson correlation analysis (SPSS 13.0)",,used,Cluster,2.2,SM1403,software,Results: Software used,1
143,non_comm,non_comm/Medicine_(Baltimore)/PMC7850739.nxml,7850739,33530185.0,10.1097/MD.0000000000023894,,2021,Statistical analysis,30,"Publication bias was investigated using a funnel plot as well as Egger linear regression test.[ The analyses were performed using Stata, version 11.0",,used,Stata,,SM2198,software,Results: Software used,1
144,non_comm,non_comm/Br_J_Cancer/PMC3241546.nxml,3241546,21952621.0,10.1038/bjc.2011.367,,2011,Gene expression analysis to compare clinical HN- and CRPC,16,"IPA identified six heuristic networks that contain 13, 12, 12, 7, 5 and 2 genes from the list of 50-identified genes, respectively",,used,IPA,,SM2531,software,Results: Software used,1
145,non_comm,non_comm/Neurol_Neuroimmunol_Neuroinflamm/PMC6410932.nxml,6410932,30882018.0,10.1212/NXI.0000000000000541,,2019,Image analysis,8,"All images were analyzed and processed using 3D Slicer (Version 4.6.2 on MacOS 10.11.4, The Slicer Community), and fslmaths integrated in the FMRIB Software Library (FSL, version 5.0, FMRIB, Oxford, United Kingdom).",,used,FMRIB Software Library (FSL,,SM14766,software,Results: Software used,1
146,non_comm,non_comm/Mol_Psychiatry/PMC5025333.nxml,5025333,26976041.0,10.1038/mp.2016.17,,2016,Behavioral Analyses,12,"Each session was video recorded and analyzed using ANY-maze software (Stoelting Co., Wood Dale, IL).",,used,ANY-maze,,SM3084,software,Results: Software used,1
147,non_comm,non_comm/mBio/PMC4620458.nxml,4620458,26463159.0,10.1128/mBio.00729-15,,2015,Mesoscale spatial variation.,16,"SIMPER analysis revealed that the abundance of the Massilia genus increased with distance from the influent pipe (average abundances: at 0.2 m, 1.36%; at 0.42 m, 14.44%; at 0.68 m, 23.10%)",,used,SIMPER,,SM5104,software,Results: Software used,1
148,non_comm,non_comm/RNA_Biol/PMC6546357.nxml,6546357,30982421.0,10.1080/15476286.2019.1602437,,2019,Data analysis,25,The overlaps between TEs and RNA transcripts were identified using BEDTools version 2.25 package [44],,used,BEDTools,,SM6739,software,Results: Software used,1
149,non_comm,non_comm/EClinicalMedicine/PMC7910713.nxml,7910713,33681741.0,10.1016/j.eclinm.2021.100732,,2021,Statistical analysis,17,Statistical analyses were conducted with R Statistical Software (version 3·6·1).,,used,R,,SM3,software,Results: Software used,1
150,non_comm,non_comm/Eur_J_Pediatr/PMC7817069.nxml,7817069,33474580.0,10.1007/s00431-021-03955-x,,2021,Methods,1,"The CDC COVID-NET is comprised of demographic variables (e.g., gender, age group, race and ethnicity, medical conditions) and date of positive SARS-CoV-2 test, as well as outcomes, including hospitalization and mortality",,mention,COVID-NET,,SM40869,software,Background: About software,2
151,non_comm,non_comm/Glob_Pediatr_Health/PMC6764026.nxml,6764026,31598542.0,10.1177/2333794X19873535,,2019,Analysis,14,Analyses were conducted in Stata 15.0.,,used,Stata,15,SM2198,software,Results: Software used,1
152,non_comm,non_comm/Retina/PMC6086222.nxml,6086222,28704254.0,10.1097/IAE.0000000000001744,,2018,Discussion,47,"In MINERVA, patients with CNV due to CSC and postinflammatory retinochoroidopathy had a treatment effect of 5.0 letters and 6.5 letters, respectively, at Month 2 after ranibizumab treatment",,used,MINERVA,,SM60751,software,Results: Software used,1
153,non_comm,non_comm/Exp_Ther_Med/PMC6122496.nxml,6122496,30186482.0,10.3892/etm.2018.6458,,2018,paper_abstract,0,"The functions of the target genes were analyzed using the Database for Annotation, Visualization and Integrated Discovery (DAVID)",,used,"Database for Annotation, Visualization and Integrated Discovery (DAVID)",,SM636,software,Results: Software used,1
154,non_comm,non_comm/Biomol_Detect_Quantif/PMC6423504.nxml,6423504,30923677.0,10.1016/j.bdq.2019.01.002,,2019,Quality control,12,Sequence quality control was performed using FastQC (courtesy of Dr,,used,FastQC,,SM648,software,Results: Software used,1
155,non_comm,non_comm/Arq_Bras_Cardiol/PMC4523287.nxml,4523287,26039660.0,10.5935/abc.20150053,,2015,Statistical analyses,20,"The G* Power software was used in order to evaluate whether the sample had statistical power to detect associations, according to the following parameters: OR = 1.5; significance level α = 0.008 (adjusted for multiple comparisons); two-tailed; statistical power 1-β = 80%",,used,G* Power,,SM66617,software,Results: Software used,1
156,non_comm,non_comm/Nat_Methods/PMC6485657.nxml,6485657,28825703.0,10.1038/nmeth.4399,,2017,Implementation of the FreemoVR Engine,22,OSG format 3D scenes can be designed using modeling software such as Blender,,used,Blender,,SM76,software,Results: Software used,1
157,non_comm,non_comm/Cell_Transplant/PMC7563027.nxml,7563027,32693640.0,10.1177/0963689720943608,,2020,Statistical Analysis,12,Data analysis was performed with SPSS version 22.0 software,,used,SPSS,,SM165,software,Results: Software used,1
158,non_comm,non_comm/Heliyon/PMC8379449.nxml,8379449,34458606.0,10.1016/j.heliyon.2021.e07757,,2021,Neurosurgical education during the COVID-19 pandemic,18,"Knowledge-based academic activities, such as scientific meetings, journal reading, and case presentations, were done online through Zoom",,used,Zoom,,SM3948,software,Results: Software used,1
159,non_comm,non_comm/ACS_Omega/PMC7114132.nxml,7114132,32258884.0,10.1021/acsomega.9b04105,,2020,Molecular Modeling,14,"Additionally, the available individual features within the Rosetta ΔΔG and FoldX PSSM force field were further evaluated against the TM dataset for correlation.",,used,Rosetta,,SM1188,software,Results: Software used,1
160,non_comm,non_comm/Nat_Chem/PMC7571259.nxml,7571259,32839603.0,10.1038/s41557-020-0514-4,,2020,"TGP-377 potently and selectively inhibits pre-miR-377 biogenesis, stimulating VEGFA",33,"First, we studied the effect of TGP-377 on miRNAs predicted to modulate VEGFA production using TargetScan (ref",,used,TargetScan,,SM4935,software,Results: Software used,1
161,non_comm,non_comm/Med_Sci_Monit/PMC4915318.nxml,4915318,27127891.0,10.12659/MSM.895907,,2016,Statistical analysis,21,"Statistical analysis was performed using the Statistica 10.0 software (StatSoft Inc., USA)",,used,Statistica,10,SM516,software,Results: Software used,1
162,non_comm,non_comm/Nucleic_Acids_Res/PMC2632904.nxml,2632904,19056824.0,10.1093/nar/gkn931,,2009,METHODS,5,Multiple alignment of all 291 proteins (46 proteins from Rebase and 245 hits generated by the BLAST search) was built using the muscle program (23) and the unrooted maximum likelihood tree with molecular clock was constructed using the proml procedure from the PHYLIP package (24),,used,muscle,,SM8348,software,Results: Software used,1
163,non_comm,non_comm/Gene_Regul_Syst_Bio/PMC3623615.nxml,3623615,23645984.0,10.4137/GRSB.S11433,,2013,Molecular network analysis,11,IPA calculates the score P-value that reflects the statistical significance of association between the genes and the networks by the Fisher’s exact test.,,mention,IPA,,SM2531,software,Background: About software,2
164,non_comm,non_comm/AIDS_Behav/PMC8231748.nxml,8231748,34173137.0,10.1007/s10461-021-03349-y,,2021,Methods,21,"All transcripts were coded line-by-line in Nvivo 11.0, a qualitative data management and analysis software [38]",,used,Nvivo,11,SM4004,software,Results: Software used,1
165,non_comm,non_comm/ACR_Open_Rheumatol/PMC7882539.nxml,7882539,33512781.0,10.1002/acr2.11189,,2021,DISCUSSION,54,DADA2 can closely mimic PAN and can result in catastrophic outcomes,,mention,DADA2,,SM6292,software,Background: About software,2
166,non_comm,non_comm/Am_J_Pathol/PMC3228917.nxml,3228917,21983634.0,10.1016/j.ajpath.2011.08.029,,2012,Gene Array and Data Analysis,6,Functional grouping of the gene list into statistically significant overrepresented ontologies was performed using the protein analysis through evolutionary relationships database analysis tools (PANTHER).,,used,PANTHER,,SM1174,software,Results: Software used,1
167,non_comm,non_comm/J_Vis/PMC7545070.nxml,7545070,33007079.0,10.1167/jov.20.10.5,,2020,Matching walkers across frames,58,"As OpenPose returns keypoints for all detected people separately for each video frame, additional processing is required to match OpenPose keypoints to a specific walker identity",,mention,OpenPose,,SM72940,software,Background: About software,2
168,non_comm,non_comm/Oncol_Res/PMC7844686.nxml,7844686,29422116.0,10.3727/096504018X15178798885361,,2018,Western Blot,6,"Blots were visualized with an enhanced chemiluminescence (ECL) detection kit (Millipore, Braunschweig, Germany) and analyzed using Quantity One 1-D Analysis Software (Bio-Rad, San Francisco, CA, USA)11.",,used,Quantity One,1-D,SM545,software,Results: Software used,1
169,non_comm,non_comm/Contemp_Clin_Dent/PMC5551326.nxml,5551326,28839407.0,10.4103/ccd.ccd_154_17,,2017,Details on quid sachets,6,"The data obtained was entered into Microsoft Excel sheet (Windows 8.1, Microsoft Corporation) and analyzed using SPSS version 16.0 (SPSS Inc., Chicago, IL, USA) mainly for frequency distribution",,used,SPSS,,SM165,software,Results: Software used,1
171,non_comm,non_comm/Bioinformatics/PMC4896370.nxml,4896370,26740523.0,10.1093/bioinformatics/btv751,,2016,3.2 SV-Bay performance on a neuroblastoma mate-pair dataset,43,"Among the 62 thousand DELLY’s predictions, there was also a translocation explaining the breakpoints on chromosomes 3 and 10 missed by other tools; it was tagged ‘LowQual’ and included 2 read pairs",,used,DELLY,,SM7125,software,Results: Software used,1
172,non_comm,non_comm/Endocrinology/PMC5551553.nxml,5551553,28586424.0,10.1210/en.2017-00349,,2017,Results,14,Enriched biological functions associated with these DE genes were identified using Ingenuity Pathway Analysis [Supplemental Fig,,used,Ingenuity Pathway Analysis,,SM7766,software,Results: Software used,1
173,non_comm,non_comm/J_Adv_Pharm_Technol_Res/PMC6621345.nxml,6621345,31334097.0,10.4103/japtr.JAPTR_389_18,,2019,paper_abstract,0,All data were analyzed using Sigma plot Software,,used,Sigma plot,,SM690,software,Results: Software used,1
174,non_comm,non_comm/Sci_Rep/PMC4260226.nxml,4260226,25488329.0,10.1038/srep07379,,2014,Analysis,17,"Post-alignment quality control and analysis (QC/QA) was performed in Partek Genomics Suite version 6.6 (Partek Inc), in order to visualise the quality of aligned reads",,used,Partek Genomics Suite,,SM8068,software,Results: Software used,1
175,non_comm,non_comm/Int_J_Gen_Med/PMC7868188.nxml,7868188,33568935.0,10.2147/IJGM.S287506,,2021,Statistical Analysis,9,"Receiver operating characteristic (ROC) curve analysis was performed using the MedCalc version 12.3 Software (Mariakerke, Belgium)",,used,MedCalc,,SM5482,software,Results: Software used,1
176,non_comm,non_comm/Encyclopedia_of_Virology/PMC7173537.nxml,7173537,,10.1016/B978-0-12-809633-8.20993-X,,2021,Single Nucleotide Differences as a Measure of Evolutionary Change,26,"This rate matches well to a genome-wide estimate of the in vitro and in vivo mutation rates for murine CMV, which was obtained by shotgun Sanger approaches just before the development of HTSeq (~1 × 10–7 mutations per bp per day)",,used,HTSeq,,SM7317,software,Results: Software used,1
178,non_comm,non_comm/Int_J_Mol_Med/PMC7053848.nxml,7053848,32124967.0,10.3892/ijmm.2020.4502,,2020,miRNA microarray analysis,25,"In order to identify the potential miRNAs that may target SCN2B, the present study focused on the downregulated miRNAs, which were also predicted by the computational algorithms TargetScan (23-27), miRanda (28) and Diana microT v5.0 (29,30) with the presence of 8-mer site in the 3′-UTR of the SCN2B gene; miR-449a, miR-34a-5p and miR-9a were identified for subsequent analyses.",,used,TargetScan,,SM4935,software,Results: Software used,1
179,non_comm,non_comm/Nucleic_Acids_Res/PMC3245920.nxml,3245920,21911355.0,10.1093/nar/gkr688,,2012,Calculation of small RNA expression fold-changes upon Dicer silencing,15,For miRDeep2 these are all predictions with a score of 0 or higher,,used,miRDeep2,,SM1666,software,Results: Software used,1
180,non_comm,non_comm/Tech_Innov_Patient_Support_Radiat_Oncol/PMC7033782.nxml,7033782,32095551.0,10.1016/j.tipsro.2019.11.007,,2019,Statistics,8,"Statistical analysis was performed using IBM SPSS version 22 (IBM Corp, Armonk, NY, USA)",,used,SPSS,,SM165,software,Results: Software used,1
182,non_comm,non_comm/Genome_Biol_Evol/PMC3914693.nxml,3914693,24398374.0,10.1093/gbe/evu004,,2014,,32,The tree was calculated by MrBayes (MIX model + gamma4),,used,MrBayes,,SM1707,software,Results: Software used,1
183,non_comm,non_comm/Nucleic_Acids_Res/PMC2686605.nxml,2686605,18996892.0,10.1093/nar/gkn732,,2009,DESIGN AND IMPLEMENTATION,8,Two CGI Perl programs which generate TFBS graphics [utilizing BioPerl graphics modules (46)] and hierarchical clustered heat maps [using Cluster 3.0 and matrix2png (47)] of tissue expression data provide the other data visualization methods.,,mention,Cluster,3,SM1403,software,Background: Simple mention,2
184,non_comm,non_comm/Brief_Funct_Genomics/PMC6063296.nxml,6063296,29579145.0,10.1093/bfgp/ely009,,2018,Analysis of cell-to-cell variation,41,"limma [166], showed slightly higher concordance scores across data sets, i.e",,used,limma,,SM2939,software,Results: Software used,1
185,non_comm,non_comm/J_Physiol/PMC6209754.nxml,6209754,30206945.0,10.1113/JP276370,,2018,Confocal microscopy,21,Images were acquired as tiles of 738.1 × 738.1 μm (0.72 μm/pixel) and automatically stitched by LAS X software (Leica),,used,LAS X,,SM15830,software,Results: Software used,1
187,non_comm,non_comm/Transl_Behav_Med/PMC7413184.nxml,7413184,30698775.0,10.1093/tbm/ibz005,,2020,Fidelity,31,Missing information was imputed using multiple imputation techniques in SPSS 22 [55],,used,SPSS,22,SM165,software,Results: Software used,1
188,non_comm,non_comm/Nat_Med/PMC4450999.nxml,4450999,25915831.0,10.1038/nm.3852,,2015,Adoptive transfer experiments,45,"Data acquisition was carried out with an 8-color flow cytometer (Canto II, BD Biosciences) and analyzed with FlowJo (Treestar).",,used,FlowJo,,SM2783,software,Results: Software used,1
